{
  "approval": {
    "allowed_actions": [
      "postgresql.fixture.create",
      "postgresql.fixture.drop"
    ],
    "approved": true
  },
  "campaign_id": "hyperfide-task-2.3-amendment-admission-v1",
  "case_ids": [
    "V-001",
    "V-014"
  ],
  "expected_assertion_ids": [
    "amendment.analysis.actual-signed-service",
    "amendment.analysis.readonly",
    "amendment.impact.active-attempts",
    "amendment.propose.immutable-record",
    "amendment.propose.manager-provenance",
    "amendment.propose.exact-replay",
    "amendment.propose.storage-immutable",
    "amendment.pin.stale-base",
    "amendment.pin.strict-fields",
    "amendment.pin.source-digest",
    "amendment.replan.cannot-weaken-global-intent",
    "amendment.replan.cannot-weaken-accepted-command",
    "amendment.replan.cannot-narrow-acceptance",
    "amendment.replan.cannot-drop-coverage",
    "amendment.replan.command-absence-is-intent",
    "amendment.replan.invalid-graph-explicit",
    "amendment.replan.cyclic-graph-explicit",
    "amendment.replan.relocation-needs-new-identity",
    "amendment.intent.explicit-operator-proposal",
    "amendment.criteria.change-needs-new-identity",
    "amendment.intent.manager-cannot-change-intent",
    "amendment.analysis.comments-are-not-task-change",
    "amendment.admit.invalid-cannot-dispatch",
    "amendment.admit.manager-cannot-admit",
    "amendment.admit.revalidation-explicit",
    "amendment.admit.during-execution",
    "amendment.admit.versioned-history",
    "amendment.evidence.irrelevant-change-retained",
    "amendment.admit.exact-replay",
    "amendment.admit.stale-proposal",
    "amendment.admit.active-compute-refused",
    "amendment.admit.revalidates-affected-only",
    "amendment.evidence.stale-history-retained",
    "amendment.requalification.new-generation-only",
    "amendment.decomposition.versioned-admission"
  ],
  "inputs": [
    {
      "path": "services/hyperfide/components/14.1.json",
      "sha256": "d90461e0c89dedac5c578a4fe57c7269b9958c38668562247dbb39e3c6cca6be",
      "size": 583
    },
    {
      "path": "services/hyperfide/components/16.4.json",
      "sha256": "7096fd353803bd0286be49e6b45fe9261ea1fda8147eda6cad5e9946d38731fc",
      "size": 355
    },
    {
      "path": "services/hyperfide/components/2.1.json",
      "sha256": "8e3c3615b3e712b9d923e2bcfa5065dd0e192e4a822f4f3c11f3421e4ad345ad",
      "size": 338
    },
    {
      "path": "services/hyperfide/components/2.2.json",
      "sha256": "c783880b0e30bb2fb3a9e08116c9e836295f86db8e142985eba719a937b731ed",
      "size": 399
    },
    {
      "path": "services/hyperfide/components/2.3.json",
      "sha256": "b65b0821fce93997bc12352c722e7fca17f333f2396f1d127bd6012f60f8337d",
      "size": 412
    },
    {
      "path": "services/hyperfide/components/2.4.json",
      "sha256": "c64dfc7057a799a1b5591a655821c99ff40810aa2f5b1fe347a5f8c3059986e9",
      "size": 356
    },
    {
      "path": "services/hyperfide/components/4.2.json",
      "sha256": "42cc05908e2eeb4692ec49a2c14dc64caf477448d431e96372fb0241bed7d061",
      "size": 278
    },
    {
      "path": "services/hyperfide/migrations/0001-authority.sql",
      "sha256": "daf573cc392955ae9d913f7fee76f88100b64ed9ceadec04dc1fe04eb5641d2c",
      "size": 110614
    },
    {
      "path": "services/hyperfide/migrations/0002-spec.sql",
      "sha256": "c620ea34060e0e6d0e148f4d086eb347b8bf2578d56c199dac9ba4184f08f221",
      "size": 9393
    },
    {
      "path": "services/hyperfide/migrations/0004-durability.sql",
      "sha256": "78ae25a9a07f14e67ab05f3ddc5f99a60b85e07673fa67c0bddc4b495e902908",
      "size": 4202
    },
    {
      "path": "services/hyperfide/migrations/0016-qualification.sql",
      "sha256": "a7e961caad8f8195438befa6cc2a8a01788af056644b5d10c21a9e4526b28115",
      "size": 13067
    },
    {
      "path": "services/hyperfide/migrations/0032-execution-packets.sql",
      "sha256": "8c2de231b95661e0d92a5c1243abe91dfd970a64a050fc91cef8550f23164637",
      "size": 3116
    },
    {
      "path": "services/hyperfide/migrations/0202-spec-dependencies.sql",
      "sha256": "85571e88952c1da0fb370de1eb9dd8ad287284a8bbcec4bef6655179cacb22e6",
      "size": 1825
    },
    {
      "path": "services/hyperfide/package-lock.json",
      "sha256": "101f5bc9fbb5864f227051eb2d0388449925df88c0fdd0e5755b40b808a4cfbb",
      "size": 128778
    },
    {
      "path": "services/hyperfide/package.json",
      "sha256": "51c686f08fdfa47386af869cd6cdb63f1d2553f99366741239ded92dfe0d4398",
      "size": 766
    },
    {
      "path": "services/hyperfide/src/assurance/validity.ts",
      "sha256": "13afc14b98c51e191b7c0e8838863c247f4ddb46499bd2a9582f5b6cf96e8283",
      "size": 25593
    },
    {
      "path": "services/hyperfide/src/components/registry.ts",
      "sha256": "070480a8b924f1e7b3c0400a6a8adf1b8b49253623189efe09fede9c987e97d8",
      "size": 12721
    },
    {
      "path": "services/hyperfide/src/components/service.ts",
      "sha256": "9bc9b235ca40944692bae091e2028715330d52930fcf2051ddf9e0c05a2736a1",
      "size": 10773
    },
    {
      "path": "services/hyperfide/src/identity/enrollment.ts",
      "sha256": "b1f041afde7b0680498603b2a2590978f566987e68435ce2157a0b119a5502e9",
      "size": 43117
    },
    {
      "path": "services/hyperfide/src/policy/programme.ts",
      "sha256": "64addcffe3ccc4b106982123688e07abf19b7656ffbceaebcd7e2d581343692e",
      "size": 5089
    },
    {
      "path": "services/hyperfide/src/spec/dependencies.ts",
      "sha256": "12c3eba89d1b14c7cfff77cdbedd60001ab7b4fa79e3610651a37f213ad1d6d1",
      "size": 24538
    },
    {
      "path": "services/hyperfide/src/spec/import.ts",
      "sha256": "ead86fc733047bd1e2cfb237238ab177a3436dac36b23a743624b6a5cc15d51f",
      "size": 28012
    },
    {
      "path": "services/hyperfide/src/spec/obligations.ts",
      "sha256": "69e9cd13226e38ae59c0ac9efe1c17928c31853a6781f3d1d3137ed2b363fbf9",
      "size": 21814
    },
    {
      "path": "services/hyperfide/src/spec/revisions.ts",
      "sha256": "c9660a10821b7d01296269851de8c9e385cb0853c3ec0a372447fdd352e1d698",
      "size": 37604
    },
    {
      "path": "services/hyperfide/src/storage/dispositions.ts",
      "sha256": "6d636efb2558b7c4306abf3764c738c7995dc37c4d01fc47623e2972c4e79b19",
      "size": 3277
    },
    {
      "path": "services/hyperfide/src/storage/durability.ts",
      "sha256": "dd4ef3a972cb74c6755e8c901667ee269da8cc2710285d43d6157f9b80430898",
      "size": 29639
    },
    {
      "path": "services/hyperfide/src/storage/schema.ts",
      "sha256": "2bdf4a5290ed882e8b1936847024210cda0ed6c5775c568dbaea515d970e54f8",
      "size": 12652
    },
    {
      "path": "services/hyperfide/src/storage/transactions.ts",
      "sha256": "fb138c8436eee05d43548db204d385efc93e071b82f3e8f567e9abf825303b7b",
      "size": 10980
    },
    {
      "path": "services/hyperfide/src/transport/protocol.ts",
      "sha256": "ddd19cd446903a7773e37e7a3e70f607df3aaa43727f54c68d5d556e87e07c0c",
      "size": 13623
    },
    {
      "path": "services/hyperfide/tsconfig.json",
      "sha256": "2b45e09325652f23d0bf4ec53439e4552cf4c2854d7288ce40186d4074f894bb",
      "size": 487
    },
    {
      "path": "tests/hyperfide/cases/tasks/2_3.py",
      "sha256": "cbf896d51db3ad64fec905412fcf5c47361434f1e7c4f1641b6bf23bd380ea1a",
      "size": 32586
    },
    {
      "path": "tests/hyperfide/check-evidence.py",
      "sha256": "cc8de56fb25bea153490b4143a231f1ff6f4dac758baaea4bf90fb7d9ba236a0",
      "size": 30633
    },
    {
      "path": "tests/hyperfide/manifest.schema.json",
      "sha256": "3407092d7e6e452bb288e996f840bd5bab22d6c0f494a49bf944cd73c18078b8",
      "size": 3216
    },
    {
      "path": "tests/hyperfide/qualify.py",
      "sha256": "8aa17f5e2572c8557f15353f7267e98600547fb0f2693486c0e0f2fc1abce8c2",
      "size": 37538
    },
    {
      "path": "tests/hyperfide/support/identity_fixture.py",
      "sha256": "2b992fd5eab4d903909a4dd621b2ce3c7278fa932e163cbad8f33cf2b65efe0a",
      "size": 29318
    },
    {
      "path": "services/hyperfide/dist/control.js",
      "sha256": "1383288f00472de29607207d1d318e257c6e80c0fb2c05ca9fb2d974040e8032",
      "size": 118
    },
    {
      "path": "services/hyperfide/dist/spec/revisions.js",
      "sha256": "09b3146bdfce916812f25ebf54204da21f521aca5ca0e3795030bae257bdfa2c",
      "size": 37816
    },
    {
      "path": "services/hyperfide/dist/spec/dependencies.js",
      "sha256": "127b2af8b26591d04b28a542f14127197f5b6fc38e1eaeb717567c60fc6b78d9",
      "size": 25894
    },
    {
      "path": "services/hyperfide/dist/spec/import.js",
      "sha256": "a68f6bb7f7dc3497a95ecc64febfbbacb0dc8d22a7cad1922ef314cc1a34e015",
      "size": 28676
    },
    {
      "path": "services/hyperfide/dist/spec/obligations.js",
      "sha256": "b3f982c5ec0823b32393f139230d5b340ba9ff637eb6dfa233b35460e2d4f33e",
      "size": 22024
    },
    {
      "path": "services/hyperfide/dist/assurance/validity.js",
      "sha256": "48c29ec0b5ec5c1513d439a80f2f492c410dca51234c940ce1898c0c8a72a33f",
      "size": 27850
    },
    {
      "path": "tests/hyperfide/registrations/2.3.json",
      "sha256": "38016661c1ab5f64bd45ff1fa4200bab06d6a499dc1ae75ef025b05f4d623185",
      "size": 4620
    },
    {
      "path": "tests/hyperfide/registry.json",
      "sha256": "59c858064cf8f112221068f9b2c6b7c9a3d5480aaad0792baa0845e1e601b52e",
      "size": 11102
    }
  ],
  "policy": {
    "cloud_provisioning": false,
    "component_only": true,
    "execution": "remote-only",
    "frontier_calls": false,
    "full_case_status": "INCOMPLETE",
    "registration_is_not_qualification": true,
    "source_policy": "accepted-input-baseline-not-future-result"
  },
  "registered_variant": "task:2.3",
  "resources": [
    {
      "id": "hf-task-2.3-database",
      "kind": "postgresql-database",
      "scope": "task2.3-disposable"
    }
  ],
  "schema_version": 1,
  "scope": "task-component",
  "seed": 1
}
