{
  "approval": {
    "allowed_actions": [
      "postgresql.fixture.create",
      "postgresql.fixture.drop",
      "https.loopback.listen"
    ],
    "approved": true
  },
  "campaign_id": "hyperfide-task-5.1-component-v1",
  "case_ids": [
    "V-002",
    "V-007"
  ],
  "expected_assertion_ids": [
    "claim.fixture.no-seeded-authority",
    "claim.strict.fields",
    "claim.role.denied",
    "claim.manager.scope",
    "claim.epoch.stale",
    "claim.spec.stale",
    "claim.vector.refused",
    "claim.failure.atomic",
    "claim.signed.ownership",
    "claim.vector.exact",
    "claim.outbox.atomic",
    "claim.exact.replay",
    "claim.replay.conflict",
    "claim.write-scope.conflict",
    "claim.dependency.not-qualified",
    "claim.wave.earlier-unqualified",
    "claim.run.not-admitting",
    "claim.proof-registry.missing",
    "claim.single-owner.second-claim-refused",
    "claim.component.registered",
    "claim.concurrent.idempotency",
    "claim.restart.replay",
    "claim.protocol.identity",
    "claim.no-false-qualification",
    "claim.destroy-intent.blocks-continuation",
    "claim.cleanup.observed",
    "claim.concurrent.multi-manager-quota",
    "claim.quota-rollback.full-vector",
    "claim.quota-cleanup.observed",
    "claim.concurrent.sandbox-budget",
    "claim.sandbox.pool-budget-independent",
    "claim.sandbox.exact-charge",
    "claim.sandbox-cleanup.observed",
    "claim.capacity.creating-uncertain-counted",
    "claim.capacity.under-boundary-admitted",
    "claim.capacity.boundary-refused-dimension",
    "claim.capacity.rate-sandbox-separate",
    "claim.capacity-cleanup.observed",
    "claim.custody.sweeper-reclaims-ordinary-expiry",
    "claim.custody.submitted.survives-expiry",
    "claim.custody.submitted.reclaim-refused",
    "claim.custody.qualifying.survives-expiry",
    "claim.custody.qualifying.reclaim-refused",
    "claim.custody.qualified.survives-expiry",
    "claim.custody.qualified.reclaim-refused",
    "claim.custody.integrating.survives-expiry",
    "claim.custody.integrating.reclaim-refused",
    "claim.custody.uncertain-resources-counted",
    "claim.custody.no-fresh-packet",
    "claim.custody-cleanup.observed"
  ],
  "inputs": [
    {
      "path": "services/hyperfide/components/5.1.json",
      "sha256": "c73623c22e058880f26667dddb3372e667be3727d2fe5b0312cfd0af47543203",
      "size": 292
    },
    {
      "path": "services/hyperfide/dist/control.js",
      "sha256": "1383288f00472de29607207d1d318e257c6e80c0fb2c05ca9fb2d974040e8032",
      "size": 118
    },
    {
      "path": "services/hyperfide/dist/scheduler/claim.js",
      "sha256": "ff642da8e5847330106e672224cdf327bd2fc9ecf234b9595af5da878ea795d4",
      "size": 82328
    },
    {
      "path": "services/hyperfide/dist/scheduler/leases.js",
      "sha256": "c60e2436c46125b615391c1503df3a5abd7e9bb34b7795d741493bd0e09f956e",
      "size": 30171
    },
    {
      "path": "services/hyperfide/dist/scheduler/resources.js",
      "sha256": "022dce7709c4ad7b2e904fa954818f1974f3141a7de480053042fb28f842308b",
      "size": 48270
    },
    {
      "path": "services/hyperfide/dist/spec/import.js",
      "sha256": "a68f6bb7f7dc3497a95ecc64febfbbacb0dc8d22a7cad1922ef314cc1a34e015",
      "size": 28676
    },
    {
      "path": "services/hyperfide/dist/storage/runtime.js",
      "sha256": "79edb921337c7546f593720dd063655e6843a0ca09c270973077da79b1bb26cd",
      "size": 18037
    },
    {
      "path": "services/hyperfide/migrations/0005-scheduling.sql",
      "sha256": "6cad3cae3af9117c8215520ee3b78ebaedfb69a79b9281f3566f56c9e01f9e78",
      "size": 26704
    },
    {
      "path": "services/hyperfide/package-lock.json",
      "sha256": "101f5bc9fbb5864f227051eb2d0388449925df88c0fdd0e5755b40b808a4cfbb",
      "size": 128778
    },
    {
      "path": "services/hyperfide/package.json",
      "sha256": "51c686f08fdfa47386af869cd6cdb63f1d2553f99366741239ded92dfe0d4398",
      "size": 766
    },
    {
      "path": "services/hyperfide/src/scheduler/claim.ts",
      "sha256": "b8c4cc9c2cdb0191a063e484d69ea001593d5be1fe54b068be903167a5a9eda3",
      "size": 86820
    },
    {
      "path": "services/hyperfide/tsconfig.json",
      "sha256": "2b45e09325652f23d0bf4ec53439e4552cf4c2854d7288ce40186d4074f894bb",
      "size": 487
    },
    {
      "path": "tests/hyperfide/cases/tasks/3_1.py",
      "sha256": "22b1a340de54a04dff4cc4624eb458f28efa54b28c9d881669331472b9801c36",
      "size": 16972
    },
    {
      "path": "tests/hyperfide/cases/tasks/3_2.py",
      "sha256": "675fd19acd8e8b8a640bef9d5d3c02827b2fe7abb6569b598a493c3954f09b1e",
      "size": 21727
    },
    {
      "path": "tests/hyperfide/cases/tasks/5_1.py",
      "sha256": "d12e8269f002e8ec787e4e981b93781e5cebec5af7252ca1b7838ba5ee1d0201",
      "size": 42972
    },
    {
      "path": "tests/hyperfide/check-evidence.py",
      "sha256": "cc8de56fb25bea153490b4143a231f1ff6f4dac758baaea4bf90fb7d9ba236a0",
      "size": 30633
    },
    {
      "path": "tests/hyperfide/manifest.schema.json",
      "sha256": "3407092d7e6e452bb288e996f840bd5bab22d6c0f494a49bf944cd73c18078b8",
      "size": 3216
    },
    {
      "path": "tests/hyperfide/qualify.py",
      "sha256": "8aa17f5e2572c8557f15353f7267e98600547fb0f2693486c0e0f2fc1abce8c2",
      "size": 37538
    },
    {
      "path": "tests/hyperfide/registrations/5.1.json",
      "sha256": "539f66fecb840bf4070d46c254dfd0d83350c2504e56d1dc8aa6c0b68c750bd8",
      "size": 3808
    },
    {
      "path": "tests/hyperfide/support/identity_fixture.py",
      "sha256": "2b992fd5eab4d903909a4dd621b2ce3c7278fa932e163cbad8f33cf2b65efe0a",
      "size": 29318
    }
  ],
  "policy": {
    "authentication_scope": "genuine Ed25519 signed HTTPS through the established service entrypoint with durable same-transaction principal guards",
    "cloud_provisioning": false,
    "component_only": true,
    "execution": "remote-only",
    "fixture_cleanup": "observed PostgreSQL database/role/private directory/loopback listener absence; no retained external resources",
    "frontier_calls": false,
    "full_case_status": "INCOMPLETE"
  },
  "registered_variant": "task:5.1",
  "resources": [
    {
      "id": "hf-task-5.1-runtime",
      "kind": "postgresql-database-role-listener",
      "scope": "task5.1-disposable"
    }
  ],
  "schema_version": 1,
  "scope": "task-component",
  "seed": 1
}
