{
  "approval": {
    "allowed_actions": [],
    "approved": true
  },
  "campaign_id": "hyperfide-driver-component-27-2-v1",
  "case_ids": [
    "V-024",
    "V-047",
    "V-048",
    "V-049"
  ],
  "expected_assertion_ids": [
    "campaign.deterministic.exact1500-reference",
    "campaign.deterministic.200-simultaneous",
    "campaign.deterministic.72-virtual-hours",
    "campaign.deterministic.complete-inventory",
    "campaign.deterministic.reject-conflicting-owner",
    "campaign.deterministic.detect-false-acceptance",
    "campaign.deterministic.stale-generation-fenced",
    "campaign.deterministic.slot-limit",
    "campaign.deterministic.replica-cannot-grant",
    "campaign.deterministic.unknown-create-reservation",
    "campaign.deterministic.duplicate-provider-object",
    "campaign.deterministic.destroying-is-not-clean",
    "campaign.deterministic.duplicate-effects",
    "campaign.deterministic.git-cas-lost-ack",
    "campaign.deterministic.worker-push-rejected",
    "campaign.deterministic.restore-fences-old-proof",
    "campaign.deterministic.reordered-observations",
    "campaign.deterministic.unknown-event",
    "campaign.deterministic.duplicate-json-rejected",
    "campaign.deterministic.nonfinite-json-rejected",
    "campaign.deterministic.seeded-schedule",
    "campaign.deterministic.schedule-workload-count",
    "campaign.deterministic.baseline-descriptive",
    "campaign.deterministic.incomparable-baseline",
    "campaign.deterministic.corpus-pin",
    "campaign.deterministic.corpus-tamper",
    "campaign.deterministic.actual-command-boundary",
    "campaign.deterministic.command-failure",
    "campaign.deterministic.wrong-request-binding",
    "campaign.deterministic.missing-auth-blocks",
    "campaign.deterministic.timeout-is-unknown",
    "campaign.deterministic.unknown-intent-retained",
    "campaign.deterministic.unpinned-executable",
    "campaign.deterministic.pinned-source-manifest",
    "campaign.deterministic.unapproved-manifest",
    "campaign.deterministic.actual19-digest-prefix",
    "campaign.deterministic.approved-corpus-required",
    "campaign.deterministic.source-set-hash-mismatch",
    "campaign.deterministic.missing-real-bridges-block"
  ],
  "inputs": [
    {
      "path": "tests/hyperfide/qualify.py",
      "sha256": "8aa17f5e2572c8557f15353f7267e98600547fb0f2693486c0e0f2fc1abce8c2",
      "size": 37538
    },
    {
      "path": "tests/hyperfide/check-evidence.py",
      "sha256": "ee8df7d7218bcfbe0229a96bd2c039fe74516bb51a7093fc85e3f1724ef019f9",
      "size": 28641
    },
    {
      "path": "tests/hyperfide/manifest.schema.json",
      "sha256": "3407092d7e6e452bb288e996f840bd5bab22d6c0f494a49bf944cd73c18078b8",
      "size": 3216
    },
    {
      "path": "tests/hyperfide/registry.json",
      "sha256": "77d72fc82aa56142b5cd19b93b0e8ecc469c01ed6182ea3d5ae53b2955580e61",
      "size": 8284
    },
    {
      "path": "tests/hyperfide/campaigns/deterministic.py",
      "sha256": "dc07481704f5e1020a9fd15f72ddf77525d83154913522b5a444ec946a2d6913",
      "size": 25259
    },
    {
      "path": "tests/hyperfide/cases/tasks/27_2.py",
      "sha256": "acdd0725d436049516979f9b8f9fe6faf0419001938fd8a6ac1bd70ceab8e5e0",
      "size": 13033
    }
  ],
  "policy": {
    "evidence_scope": "DRIVER_COMPONENT_ONLY",
    "fixture_scope": "Public synthetic component validation plus actual bounded subprocess/canonical-checker boundaries; no live fleet occupancy",
    "full_campaign_source_binding": "policy.source_manifest_digest must equal actual19 integratedRepositoryManifest sha256-prefixed digest",
    "full_campaigns": "UNRUN; require actual signed API bridges and approved pinned corpus/auth/profile/SLO inputs",
    "full_case_status": "INCOMPLETE"
  },
  "registered_variant": "task:27.2",
  "resources": [],
  "schema_version": 1,
  "scope": "task-component",
  "seed": 17
}
