{
  "approval": {
    "allowed_actions": [],
    "approved": true
  },
  "campaign_id": "hyperfide-harness-required-artifact-history-v2",
  "case_ids": [
    "V-056"
  ],
  "expected_assertion_ids": [
    "harness.selector.missing",
    "harness.selector.unknown",
    "harness.selector.empty",
    "harness.selector.duplicate",
    "harness.selector.empty-suite",
    "harness.runner.missing",
    "harness.child.missing",
    "harness.checker.missing",
    "harness.fixture.missing",
    "harness.fixture.digest",
    "harness.credential.missing",
    "harness.child.failure",
    "harness.child.timeout-descendants",
    "harness.assertion.zero",
    "harness.assertion.duplicate",
    "harness.assertion.unexecuted",
    "harness.assertion.failure",
    "harness.assertion.malformed",
    "harness.cleanup.missing",
    "harness.cleanup.failure",
    "harness.artifact.missing",
    "harness.artifact.tampered",
    "harness.receipt.tampered",
    "harness.receipt.scope-forgery",
    "harness.receipt.inventory-forgery",
    "harness.campaign.snapshot-tampered",
    "harness.campaign.append-only",
    "harness.campaign.changed-input",
    "harness.selector.task",
    "harness.selector.suite",
    "harness.campaign.failed-then-pass",
    "harness.checker.canonical",
    "harness.child.normal-exit-descendants",
    "harness.source.declared-import",
    "harness.source.undeclared-import-in-root",
    "harness.cleanup.retention-approved",
    "harness.cleanup.retention-unapproved",
    "harness.cleanup.retention-owner-missing",
    "harness.cleanup.retention-expiry-missing",
    "harness.schema.registry-version-bool",
    "harness.schema.registration-version-bool",
    "harness.schema.manifest-version-bool",
    "harness.schema.input-size-bool",
    "harness.schema.manifest-unknown-field",
    "harness.schema.approval-unknown-field",
    "harness.source.output-equals-workspace",
    "harness.source.output-contains-probe",
    "harness.child.detached-pipe-timeout",
    "harness.source.git-bytecode-parity",
    "harness.artifact.required-per-receipt",
    "harness.artifact.old-snapshot-tamper",
    "harness.artifact.logical-alias-forgery",
    "harness.cleanup.immutable-absence-reference"
  ],
  "inputs": [
    {
      "path": "tests/hyperfide/qualify.py",
      "sha256": "8aa17f5e2572c8557f15353f7267e98600547fb0f2693486c0e0f2fc1abce8c2",
      "size": 37538
    },
    {
      "path": "tests/hyperfide/check-evidence.py",
      "sha256": "ee8df7d7218bcfbe0229a96bd2c039fe74516bb51a7093fc85e3f1724ef019f9",
      "size": 28641
    },
    {
      "path": "tests/hyperfide/selftest_harness.py",
      "sha256": "e9d87abe2420dde60da99a64860712885acda617440fde227ec26cde47d430d8",
      "size": 31610
    },
    {
      "path": "tests/hyperfide/cases/tasks/27_1.py",
      "sha256": "f162320202f0362dcb88ec322b6315b744fd60bc6ef713a24007e67d1df59e2b",
      "size": 391
    },
    {
      "path": "tests/hyperfide/manifest.schema.json",
      "sha256": "3407092d7e6e452bb288e996f840bd5bab22d6c0f494a49bf944cd73c18078b8",
      "size": 3216
    },
    {
      "path": "tests/hyperfide/test_required_artifact_receipts.py",
      "sha256": "8a2bc11c8262a64a20604d3c74372067cc98cb40f38747d901bf63d5b4eb54cc",
      "size": 6123
    }
  ],
  "policy": {
    "cloud_provisioning": false,
    "component_only": true,
    "execution": "remote-only",
    "frontier_calls": false
  },
  "registered_variant": "task:27.1",
  "resources": [],
  "schema_version": 1,
  "scope": "task-component",
  "seed": 1
}
